{"schema_status":"provisional-m2-json-compatible-yaml","version":"0.2.0","updated_on":"2026-08-24","scope":"fixture","model":{"id_policy":"stable","requires":"strong","recommended_before":"recommended","co_requisites":"parallel","enables":"derived","learning_phases":["introduce"],"learning_phase_location":"curriculum","review_note":"legacy flags"},"domains_considered":["orthography"],"skills":[{"id":"orth.fixture.recognize","title_ja":"fixture","short_description":"構造検査用。","domain":"orthography","level":"introductory","requires":[],"recommended_before":[],"co_requisites":[],"evidence_refs":["design:DEC-0011"],"introduced_in":"unit-01a","notes":"fixture","review":{"source_checked":false,"editorial_approved":false,"expert_reviewed":false}}]}
